{
  "schema_version": "atlas-control-plane/retirement-evidence/v1",
  "retirement_id": "retirement:sha256:55b2741ccde866b98c86ee6d0d56a53755554de028ed800d4711a4b3b02e7948",
  "subject": {"kind": "service", "service_id": "atlas-api-index"},
  "state": "deprecated",
  "evidence": {"dependencies_clear": "unknown", "routes_clear": "unknown", "bindings_clear": "unknown", "manifest_clear": "unknown", "worker_allowlist_clear": "unknown", "production_prs_clear": "verified", "historical_evidence_preserved": "verified", "recovery_handled": "not-applicable"},
  "visibility": "public",
  "recorded_at": "2026-07-21T22:30:00Z",
  "approved_by": "AtlasReaper311",
  "note": "Example deprecation evidence; final archival remains blocked until runtime and publication checks are verified."
}
